Journal Title,Publisher,ISSN,ISSNOnline,Year Inception,FoR,2025 rating
4OR ,Springer Nature,1619-4500,1614-2411	,2003	,3599,B 
AACE International Transactions,AACE International,1528-7106,1528-7106	,1967	,3599,B 
Abacus,Wiley-Blackwell Publishing,0001-3072,1467-6281	,1965	,3501,A 
Academia Economic Papers,"Institute of Economics, Academia Sinica",1018-161X	,	,1973	,3801,C 
Academy of Management Annals,Academy of Management,1941-6520	,1941-6067	,2008	,3507,A* 
Academy of Management Discoveries,Academy of Management,2168-1007	,	,2015	,3507,A*
Academy of Management Journal,Academy of Management ,0001-4273	,1948-0989	,1958	,3507,A* 
Academy of Management Learning and Education,Academy of Management ,1537-260X,1944-9585	,2002	,3507,A* 
Academy of Management Perspectives,Academy of Management ,1558-9080	,1943-4529	,1987	,3507,A 
Academy of Management Review,Academy of Management ,0363-7425	,1930-3807	,1976	,3507,A* 
Academy of Marketing Studies Journal,Allied Business Academies,1095-6298,1528-2678	,1980	,3506,B
Accident Analysis and Prevention,Elsevier ,0001-4575	,1879-2057	,1969	,3509,A* 
Accountancy Business and the Public Interest,Association for Accountancy & Business Affairs,1745-7718	,	,2002	,3501,B
Accounting & Finance Journal / Revista Contabilidade & Finanças,University of São Paulo,1519-7077,1808-057X,,3501,C
Accounting Accountability and Performance,Griffith University,1445-954X	,	,1995	,3501,C 
Accounting and Business Research,Taylor & Francis Online,0001-4788	,2159-4260	,1970	,3501,A 
Accounting and Finance,Wiley-Blackwell Publishing,0810-5391	,1467-629X	,1961	,3501,A 
Accounting and Taxation,Institute for Business and Finance Research,1944-592X	,	,2007	,3501,C 
Accounting and the Public Interest,American Accounting Association,1530-9320	,	,2001	,3501,B 
Accounting Auditing and Accountability Journal,Emerald Group Publishing Limited,0951-3574	,1758-4205	,1988	,3501,A*
Accounting Education,Taylor & Francis Online,0963-9284	,1468-4489	,1992	,3501,A
Accounting Educators Journal,Academy of Accounting Educators Inc.,1041-0392	,	,1988	,3501,B
Accounting Forum,Taylor & Francis Online,0155-9982	,1467-6303	,2004	,3501,A
Accounting Historians Journal,American Accounting Association ,0148-4184	,	,1977	,3501,B 
Accounting History,Sage Publications,1032-3732	,1749-3374	,1989	,3501,A
Accounting History Review,Taylor & Francis Online,2155-2851	,2155-286X	,2011	,3501,B 
Accounting Horizons,American Accounting Association,0888-7993	,1558-7975	,1987	,3501,A 
Accounting in Europe,Taylor & Francis Online,1744-9480	,1744-9499	,2004	,3501,A
Accounting Perspectives,Wiley-Blackwell Publishing,1911-382X	,1911-3838	,2002	,3501,B
Accounting Research Journal,Emerald Group Publishing Limited,1030-9616	,	,1986	,3501,B 
Accounting Theory and Practice,Elsevier ScienceDirect,2949-9453,,,3501,C
"Accounting, Economics and Law – A Convivium",De Gruyter ,2194-6051,2152-2820,2011,3501,B
"Accounting, Finance and Governance Review",Irish Accounting and Finance Association,0791-9638	,	,1994	,3501,C 
"Accounting, Organizations and Society",Elsevier ,0361-3682	,1873-6289	,1976	,3501,A* 
ACM Transactions on Information Systems,Association for Computing Machinery,1046-8188	,1558-2868	,1983	,4609,C 
ACM Transactions on Modeling and Computer Simulation,Association for Computing Machinery,1049-3301	,1558-1195	,1991	,3599,B 
Acta Oeconomica,Akademiai Kiado,0001-6373	,1588-2659	,1951	,3899,C 
Acta Psychologica,Elsevier ,0001-6918	,1873-6297	,1936	,3507,A 
Acta Turistica,"University of Zagreb, Faculty of Economics and Business",0353-4316	,1848-6061	,1989	,3508,C
Acta Universitatis Bohemiae Meridionalis,University of South Bohemia Faculty of Economics,1212-3285	,2336-4297	,1971	,3801,C 
Action Learning and Action Research Journal,ALARA Association Inc.,1326-964X	,1326-964X	,1996	,3507,C 
Action Learning Research and Practice,Taylor and Francis Online,1476-7333,1476-7341,2004,3507,C
Active Learning in Higher Education,Sage Publications,1469-7874	,1741-2625	,2000	,3505,B
Actuarial Research Clearinghouse,SOA Education and Research Section,0732-5428	,	,2004	,3502,C 
Adelaide Law Review,University of Adelaide ,0065-1915	,	,1960	,4801,A 
Administration and Society,Sage Publications,0095-3997	,1552-3039	,1975	,3507,B
Administrative Science Quarterly,Sage Publications,0001-8392,1930-3815	,1956	,3507,A* 
Administrative Sciences,MDPI,,2076-3387,2011,3507,C
Administrative Theory and Praxis,Taylor & Francis Online,1084-1806	,1949-0461	,1979	,3507,B 
Advances and Applications in Statistics,Pushpa Publishing House,0972-3617	,	,2001	,4905,C 
Advances in Accounting,Elsevier ,0882-6110	,1046-5715	,1984	,3501,A
Advances in Accounting Behavioral Research,Emerald Group Publishing,1475-1488	,	,1998	,3501,A
Advances in Accounting Education: teaching and curriculum innovations,Emerald Group Publishing,1085-4622	,	,1996	,3501,C 
Advances in Applied Probability,Applied Probability Trust,0001-8678	,1475-6064	,1964	,4905,A
Advances in Consumer Research,Association for Consumer Research,0098-9258	,	,1974	,3506,B
Advances in Developing Human Resources,Sage Publications,1523-4223	,1552-3055	,1999	,3505,C 
Advances in Environmental Accounting and Management,Emerald Group Publishing,1479-3598,,2000,3501,B
Advances in Experimental Social Psychology,Elsevier ,0065-2601	,1557-8410	,1964	,3507,A* 
Advances in Hospitality and Leisure,Emerald Group Publishing,1745-3542	,	,2005	,3504,C 
Advances in International Management,Emerald Group Publishing,1571-5027	,,1988	,3507,C 
Advances in International Marketing,Emerald Group Publishing,1474-7979	,	,1986	,3506,C
Advances in Management Accounting,Emerald Group Publishing,1474-7871	,	,1990	,3501,A
Advances in Public Interest Accounting,Emerald Group Publishing,1041-7060	,	,1986	,3501,C 
Advances in Strategic Management,Emerald Group Publishing,0742-3322	,,1983	,3507,C 
Advances in Taxation,Emerald Group Publishing,1058-7497	,	,1987	,4801,B 
Advertising & Society Review,Johns Hopkins University Press,2475-1790,1534-7311	,2000	,3506,C
Afaq Iqtisadiyyah,Federation of UAE Chambers of Commerce and Industry: Centre for Research and Authentication ,1024-266X	,	,1980	,3801,C 
Africa Development/Afrique et Developpement,Council for the Development of Economic and Social Research in Africa,0850-3907	,	,1976	,3899,C 
African Development Review,Wiley-Blackwell Publishing,1017-6772	,1467-8268	,1989	,3899,C 
African Economic History,University of Wisconsin Press,0145-2258	,2163-9108	,1974	,3801,C 
"African Journal of Accounting, Auditing and Finance",Inderscience Enterprises Ltd. ,2046-8083	,2046-8091	,2012	,3501,C 
African Journal of Agricultural and Resource Economics,African Association of Agricultural Economists,1993-3738	,2521-9871	,2006	,3801,B 
African Journal of Business and Economic Research,Adonis and Abbey Publishers Ltd,1750-4554	,1750-4562	,2006	,3801,C 
African Journal of Economic and Management Studies,Emerald Group Publishing,2040-0705	,2040-0713	,2010	,3507,C 
African Journal of Economic and Sustainable Development,Inderscience Enterprises Ltd.,2046-4770	,2046-4789	,2012	,3801,C
African Review of Economics and Finance,Wits University Press,2042-1478,2410-4906,2009,3801,C
Afrika Spectrum,Deutsches Institut für Afrika-Forschung,0002-0397	,1868-6869	,1966	,3801,C 
Afro-Asian Journal of Finance and Accounting,Inderscience Enterprises Ltd.,1751-6447	,1751-6455	,2008	,3502,C 
AgBioForum,Illinois Missouri Biotechnology Alliance ,1522-936X	,	,1998	,3801,C 
Agenda: a journal of policy analysis and reform,Australian National University ,1322-1833	,1447-4735	,1994	,3801,B 
Agribusiness: An international journal,Wiley-Blackwell Publishing,0742-4477	,1520-6297	,1984	,3801,C 
Agricultural and Resource Economics Review,Cambridge University Press,1068-2805	,2372-2614	,1972	,3801,B 
Agricultural Economics,Wiley-Blackwell Publishing,0169-5150	,1574-0862	,1928	,3801,A 
Agricultural Economics and Rural Development,Institute of Agricultural Economics,,,2004	,3899,C 
Agricultural Economics Research Review,Sage Publications,0971-3441	,0974-0279	,1988	,3899,C 
Agricultural Economics Review,Greek Association of Agricultural Economists,1109-2580	,	,2000	,3899,C 
Agricultural Finance Review,Emerald Group Publishing,0002-1466	,2041-6326	,1931	,3502,C 
Agriculture and Human Values,Springer International Publishing,0889-048X	,1572-8366	,1984	,3801,B 
AIMS International Journal of Management,AIMS International,1939-7011,,2007,3507,C
Air and Space Law,Kluwer Law International ,0927-3379	,1875-8339	,1974	,4801,B 
AIS Educator Journal,Allen Press Inc.,1935-8156	,	,2006	,3501,C 
AIS Transactions on Human-Computer Interaction,Association for Information Systems,1944-3900,,2009,4609,A
Akron Tax Journal,University of Akron,1044-4130	,	,1983	,4801,B 
Alberta Law Review,University of Alberta,0002-4821	,	,1955	,4801,B 
Algorithmic Finance,Sage Publications,2158-5571	,2157-6203	,2011	,3502,B
ALI - ABA Business Law Course Materials Journal,American Law Institute,1536-4445	,	,1976	,4801,C 
Aligarh Journal of Statistics,Aligarh Muslim University,0971-0388	,	,1981	,4905,C 
Alternative Law Journal,Sage Publications,1037-969X,2398-9084,1975,4801,B
"Alternatives: global, local, political",Sage Publications ,0304-3754	,2163-3150	,1974	,3507,A 
American Bankruptcy Institute Law Review,St. John's University School of Law,1068-0861	,	,1993	,4801,B 
American Bankruptcy Law Journal,The National Conference of Bankruptcy Judges,0027-9048	,	,1971	,4801,B 
American Behavioral Scientist,Sage Publications,0002-7642	,1552-3381	,1957	,3507,B 
American Business Law Journal,Wiley-Blackwell Publishing,0002-7766	,1744-1714	,1963	,4801,A
American Business Review,University of New Haven,0743-2348	,0743-2348	,1983	,3507,B
American Economic Journal: Applied Economics,American Economic Association ,1945-7782	,1945-7790	,2009	,3801,A* 
American Economic Journal: Economic Policy,American Economic Association ,1945-7731	,1945-774X	,2009	,3801,A* 
American Economic Journal: Macroeconomics,American Economic Association ,1945-7707	,1945-7715	,2009	,3801,A* 
American Economic Journal: Microeconomics,American Economic Association ,1945-7669	,1945-7685	,2009	,3801,A* 
American Economic Review: Insights,American Economic Association,2640-205X,2640-2068,2019,3801,A*
American Economist,Sage Publications ,0569-4345	,2328-1235	,1960	,3801,C 
American International Journal of Business and Management Studies ,American Center of Science and Education,2641-4937 ,2641-4953,2019,3507,C
American Journal of Agricultural Economics,Oxford University Press ,0002-9092	,1467-8276	,1919	,3801,A* 
American Journal of Business (AJB),Emerald Publishing,1935-519X,1935-5181,1986,3507,C
American Journal of Comparative Law,Oxford University Press,0002-919X	,2326-9197	,1951	,4801,A
American Journal of Economics and Sociology,Wiley-Blackwell Publishing,0002-9246	,1536-7150	,1941	,3801,B 
American Journal of Evaluation,Sage Publications,1098-2140	,1557-0878	,1981	,3503,C 
American Journal of Finance and Accounting,Inderscience Publishers,1752-7767	,1752-7775	,2008	,3502,C 
American Journal of Health Economics,MIT Press,2332-3493	,2332-3507	,2015	,3801,A*
American Journal of Political Science,Wiley-Blackwell Publishing,0092-5853	,1540-5907	,1950	,3599,A* 
American Journal of Public Health,The American Public Health Association,0090-0036	,1541-0048	,1911	,3599,A* 
American Journal of Recreation Therapy,Weston Medical Publishing,1539-4131	,	,2002	,3504,C 
American Journal of Sociology,The University of Chicago Press,0002-9602	,1537-5390	,1895	,3507,A* 
American Law and Economics Review,Oxford University Press ,1465-7252	,1465-7260	,1999	,3801,B 
American Political Science Review,Cambridge University Press,0003-0554	,1537-5943	,1906	,3599,A* 
American Psychologist,American Psychological Association ,0003-066X	,1935-990X	,1946	,3507,A* 
American Review of Political Economy,American Review of Political Economy,1551-1383	,	,2002	,3899,C 
American Review of Public Administration,Sage Publications,0275-0740	,1552-3357	,1967	,3599,B 
American Sociological Review,Sage Publications,0003-1224	,1939-8271	,1936	,3507,A* 
AMS Review,Springer International Publishing,1869-814X	,1869-8182	,1997	,3506,B
Analisis: cuadernos de investigacion,Centre for Latin American Monetary Studies (CEMLA),0252-8851	,	,1977	,3801,C 
Analytic Methods in Accident Research,Elsevier,2213-6657,2213-6665,2014,3509,B
Anatolia,Taylor & Francis Online,1303-2917	,2156-6909	,1990	,3508,B
Annals Economy Series,Universitatea Constantin Brancusi din Targu-Jiu,1844-7007	,	,2009	,3899,C 
Annals of Actuarial Science,Cambridge University Press,1748-4995	,1748-5002	,2006	,3502,A 
Annals of Applied Probability,Institute of Mathematical Statistics,1050-5164	,2168-8737	,1991	,4905,A
Annals of Applied Statistics,Institute of Mathematical Statistics,1932-6157	,1941-7330	,2007	,4905,A
Annals of Economics and Finance,Peking University Press,1529-7373	,	,2000	,3502,C 
Annals of Finance,Springer International Publishing,1614-2446	,1614-2454	,2005	,3502,B 
Annals of Leisure Research,Routledge,1174-5398	,2159-6816	,1998	,3504,B
Annals of Operations Research,Springer International Publishing,0254-5330	,1572-9338	,1984	,3507,A 
Annals of Probability,Institute of Mathematical Statistics,0091-1798	,2168-894X	,1973	,4905,A* 
Annals of Public and Cooperative Economics,Wiley-Blackwell Publishing,1370-4788	,1467-8292	,1925	,3801,B 
Annals of Statistics,Institute of Mathematical Statistics,0090-5364	,	,1973	,4905,A* 
Annals of the American Academy of Political and Social Science,Sage Publications,0002-7162	,1552-3349	,1891	,3599,B 
Annals of the Institute of Statistical Mathematics,Springer International Publishing,0020-3157	,1572-9052	,1949	,4905,A 
Annals of Tourism Research,Elsevier ,0160-7383	,1873-7722	,1973	,3508,A*
Annals of Tourism Research Empirical Insights ,Elsevier,2666-9579,2666-9579,,3508,B
Annual Editions: Economics,Dushkin Publ. Group,1092-776X	,	,1971	,3801,C 
Annual Review of Banking and Financial Law,Boston University School of Law,1544-4627	,	,1982	,4801,C 
Annual Review of Economics,Annual Reviews ,1941-1383	,1941-1391	,2009	,3801,A*
Annual Review of Financial Economics,Annual Reviews ,1941-1367	,1941-1375	,2009	,3801,B 
Annual Review of Organizational Psychology and Organizational Behavior,Annual Reviews,2327-0616	,	,2014	,3507,A* 
Annual Review of Psychology,Annual Reviews ,0066-4308	,1545-2085	,1950	,3507,A* 
Annual Review of Resource Economics,Annual Reviews ,1941-1340	,1941-1359	,2009	,3801,B 
Annual Review of Sociology,Annual Reviews ,0360-0572	,1545-2115	,1975	,3507,A* 
Anti Trust Law Journal,American Bar Association ,0003-6056	,	,1952	,4801,A 
Antitrust Bulletin,Sage Publications,0003-603X	,1930-7969	,1955	,4801,B 
Appetite,Elsevier,0195-6663	,1095-8304	,1980	,3506,A
Applied Cognitive Psychology,Wiley-Blackwell Publishing,0888-4080	,1099-0720	,1987	,3507,B 
Applied Econometrics,"Moscow University for Industry and Finance Synergy"" """,1993-7601	,2410-6445	,2006	,3802,C 
Applied Econometrics and International Development,Euro-American Association of Economic Development Studies,1578-4487	,	,2001	,3802,C 
Applied Economic Analysis,Emerald Publishing Group,2632-7627,,,3801,B
Applied Economic Perspectives and Policy,Oxford University Press ,2040-5804	,2040-5970	,1979	,3801,B 
Applied Economics,Taylor & Francis Online,0003-6846	,1466-4283	,1969	,3801,A
Applied Economics Letters,Taylor & Francis Online,1350-4851	,1466-4291	,1994	,3801,B 
Applied Economics Quarterly,Duncker & Humblot Gmbh,1611-6607	,1865-5122	,1952	,3801,B 
Applied Energy,Elsevier,0306-2619,,1975,3599,A
Applied Finance Letters,Auckland University of Technology,2253-5799	,2253-5802	,2012	,3502,B
Applied Financial Economics,Taylor & Francis Online,0960-3107	,1466-4305	,1991	,3502,B 
Applied Health Economics and Health Policy,Springer International Publishing,1175-5652	,1179-1896	,2002	,3801,C 
Applied Mathematical Finance,Taylor & Francis Online,1350-486X	,1466-4313	,1994	,3502,B 
Applied Psychological Measurement,Sage Publications,0146-6216	,1552-3497	,1977	,3507,B 
Applied Psychology: An International Review,Wiley-Blackwell Publishing,0269-994X	,1464-0597	,1952	,3507,A 
Applied Research in Quality of Life,Springer Nature ,1871-2584,1871-2576,,3599,B
Applied Stochastic Models in Business and Industry,Wiley-Blackwell Publishing,1524-1904	,1526-4025	,1985	,4905,B 
Appraisal Journal,Appraisal Institute,0003-7087	,	,1932	,3504,B 
Aquaculture Economics and Management,Taylor & Francis Online,1365-7305	,1551-8663	,1997	,3801,C 
Arizona Law Review,HeinOnline,0004-153X	,	,1959	,4801,B 
Arkansas Business and Economic Review,"University of Arkansas, Bureau of Business and Eco",0004-1742	,	,1933	,3801,C 
Artha-Vikas: a journal of economic development,Sardar Patel University,0004-3567	,	,1965	,3801,C 
Arts and the Market (formerly Arts Marketing),Emerald Group Publishing,2044-2084	,2056-4945	,	,3506,C
ASEAN Journal on Hospitality and Tourism,Institut Teknologi Bandung,1412-2073	,	,2002	,3508,C
Asia Europe Journal,Springer International Publishing,1610-2932	,1612-1031	,2003	,3599,B 
Asia Pacific Business Review,Taylor & Francis Online,1360-2381	,1743-792X	,1994	,3507,B
Asia Pacific Journal of Economics and Business,Taylor & Francis Online,1326-8481	,	,1997	,3801,B 
Asia Pacific Journal of Finance,Wiley-Blackwell Publishing,0219-1466	,	,1998	,3502,B 
Asia Pacific Journal of Health Management,Australian College of Health Service Executives,1833-3818	,1833-3818	,2006	,3599,C 
Asia Pacific Journal of Information Systems,Korea Society of Management Information Systems,2288-5404,2288-6818,1990,4609,B
Asia Pacific Journal of Management,Springer International Publishing,0217-4561	,1572-9958	,1983	,3507,A
Asia Pacific Journal of Marketing and Logistics,Emerald Group Publishing,1355-5855	,1758-4248	,1988	,3506,A 
Asia Pacific Journal of Taxation,Hong Kong Polytechnic University,1027-5592	,	,1997	,4801,C 
Asia Pacific Journal of Tourism Research,Taylor & Francis Online,1094-1665	,1741-6507	,1996	,3508,A
Asia Pacific Law Review,Taylor & Francis Online,1019-2557	,1875-8444	,1992	,4801,C 
Asia Pacific Public Relations Journal,University of Newcastle,1440-4389	,1839-8227	,1999	,3506,B
Asia Pacific Sustainable Development Journal,United Nations ESCAP,1020-1246	,	,1956	,3899,B 
Asia-Pacific Financial Markets,Springer International Publishing,1387-2834	,1573-6946	,1994	,3502,C 
Asia-Pacific Journal of Accounting and Economics,Taylor & Francis Online,1608-1625	,2164-2257	,2000	,3501,B 
Asia-Pacific Journal of Business Administration,Emerald Group Publishing,1757-4323	,1757-4331	,2009	,3507,B
Asia-Pacific Journal of Financial Studies,Wiley-Blackwell Publishing,2041-9945,2041-6156,1980,3502,B
Asia-Pacific Journal of Human Resources,Wiley-Blackwell Publishing,1038-4111	,1744-7941	,1966	,3505,A
Asia-Pacific Journal of Innovation in Hospitality and Tourism,"Taylors' University, Malaysia",2710-6519,,,3508,C
Asia-Pacific Journal of Risk and Insurance,De Gruyter,2194-606X,2153-3792	,2005	,3502,B 
Asia-Pacific Management Accounting Journal,Universiti Teknologi MARA (UiTM) Press,1675-3194	,2550-1631	,2006	,3501,C 
Asia-Pacific Management Review,Elsevier,1029-3132	,2589-8213	,1996	,3507,C
Asia-Pacific Tax Bulletin,International Bureau of Fiscal Documentation,1385-3082	,	,1983	,4801,C 
Asian Academy of Management Journal,Penerbit Universiti Sains Malaysia,1394-2603	,2180-4184	,1996	,3507,C 
Asian Academy of Management Journal of Accounting and Finance,Asian Academy of Management / Penerbit Universiti Sains Malaysia,1823-4992,2180-4192	,2005	,3501,C 
Asian and Pacific Economic Review,ya tai jing ji bian ji bu  ,1000-6052	,	,1985	,3801,C 
Asian and Pacific Migration Journal,Sage Publications,0117-1968	,	2057-049X,1992	,3599,C 
Asian Business and Management,Springer International Publishing,1472-4782	,1476-9328	,2002	,3507,C 
Asian Development Review,MIT Press,0116-1105	,0116-1105	,1983	,3801,C 
Asian Economic Journal,Wiley-Blackwell Publishing,1351-3958	,1467-8381	,1987	,3801,B 
Asian Economic Papers,MIT Press,1535-3516	,1536-0083	,2002	,3801,B 
Asian Economic Policy Review,Wiley-Blackwell Publishing,1832-8105	,1748-3131	,2006	,3801,C 
Asian Economics Letters,Asia-Pacific Applied Economics Association,2652-8681,,,3801,C
Asian Economies,Ajia Keizai Kenkyujo,0002-2942	,	,1960	,3801,C 
Asian Journal of Accounting and Governance,Universiti Kebangsaan Malaysia (UKM) Press,2180-3838	,	,2010	,3501,C 
Asian Journal of Accounting Research,Emerald Group Publishing,2459-9700,2443-4175,2016,3501,B
Asian Journal of Agriculture and Development,Southeast Asian Regional Center for Graduate Study and Research in Agriculture,1656-4383	,2599-3879	,2004	,3899,C
Asian Journal of Business and Accounting,University of Malaya,1985-4064,2180-3137,,3501,C
Asian Journal of Business Ethics,Springer International Publishing,2210-6723,2210-6731,2012,3507,C
Asian Journal of Business Research,Asia Business Research Corporation Limited,2463-4522	,1178-8933	,2011	,3506,C
Asian Journal of International Law,Cambridge University Press,2044-2513	,2044-2521	,1997	,4801,C 
Asian Journal of Management Cases,Sage Publications,0972-8201,0973-0621,2004,3501,C
Asian Journal of Marketing (SING),"Marketing Institute of Singapore and Faculty of Business Administration, National University of Singapore",0218-6101	,	,1992	,3506,C
Asian Journal of Political Science,Taylor & Francis Online,0218-5377	,1750-7812	,1993	,3599,B 
Asian Journal of Social Science,Elsevier,1568-4849	,1568-5314	,1973	,3599,C 
Asian Population Studies,Taylor & Francis Online,1744-1730	,1744-1749	,2005	,3599,B 
Asian Review of Accounting,Emerald Group Publishing,Emerald Group Publishing,1758-8863	,1992	,3501,B 
Asian Survey,University of California Press,0004-4687	,1533-838X	,2011	,3599,C 
Asian-Pacific Economic Literature,Wiley-Blackwell Publishing,0818-9935	,1467-8411	,1987	,3801,C 
ASOR Bulletin,Australian Society for Operations Reseach Inc. ,0812-860X	,1446-6678	,1981	,3509,C 
Asper Review of International Business and Trade Law,"University of Manitoba, Faculty of Law",1496-9572	,	,2001	,4801,C 
AStA Advances in Statistical Analysis,Springer Nature,1863-8171	,1863-818X	,1916	,4905,C 
ASTIN Bulletin,Cambridge University Press,0515-0361	,1783-1350	,1960	,3502,A* 
ATA Journal of Legal Tax Research,American Accounting Association,1543-866X	,	,2003	,4801,C 
Atlantic Economic Journal,Springer International Publishing,0197-4254	,1573-9678	,1973	,3801,C 
Auckland University Law Review,Auckland University Law Students' Society,0067-0510	,	,1967	,4801,C 
Audit Financiar,Chamber of Financial Auditors in Romania,1583-5812,1844-8801,2003,3501,C
Auditing: A Journal of Practice and Theory,American Accounting Association,0278-0380	,1558-7991	,1981	,3501,A* 
Australasian Accounting Business and Finance Journal,University of Wollongong,1834-2000	,1834-2019	,2007	,3501,B
Australasian Agribusiness Review,University of New England,1442-6951	,	,1993	,3599,C 
Australasian Dispute Resolution Journal,Thomson Reuters,1441-7847	,1441-7847	,1990	,4801,C
Australasian Journal of Economics Education,University of Queensland,1448-448X	,1448-4498	,2004	,3801,C 
Australasian Journal of Information Systems,Australasian Association for Information Systems (AAIS),1449-8618	,1326-2238	,1983	,4609,A 
Australasian Journal of Natural Resources Law and Policy,University of Wollongong,1320-5323	,	,1993	,4801,B 
Australasian Journal of Regional Studies,Australian and New Zealand Regional Science Association,1324-0935	,	,1995	,3599,B 
Australasian Journal on Ageing,Wiley-Blackwell Publishing,1440-6381	,1741-6612	,1982	,3599,B 
Australasian Marketing Journal,Sage Publications,1441-3582	,1839-3349	,1993	,3506,A
Australian Accounting Review,Wiley-Blackwell Publishing,1035-6908	,1835-2561	,1991	,3501,B 
Australian and New Zealand Journal of Criminology,Sage Publications,0004-8658	,1837-9273	,1968	,4801,A 
Australian and New Zealand Journal of Statistics,Wiley-Blackwell Publishing,1369-1473	,1467-842X	,1959	,4905,A 
Australian Bar Review,LexisNexis,0814-8589	,	,1986	,4801,A 
Australian Business Law Review,Thomson Reuters,0310-1053	,	,1973	,4801,A 
Australian Commodities,Australian Bureau of Agricultural and Resource Economics,1321-7844	,	,1948	,3801,C 
Asia‐Pacific Economic History Review,Wiley-Blackwell Publishing,0004-8992	,1467-8446	,1956	,3801,B
Australian Economic Papers,Wiley-Blackwell Publishing,0004-900X	,1467-8454	,1962	,3801,B
Australian GST Journal,Thomson Reuters,1445-4068	,	,1998	,4801,C 
Australian Intellectual Property Journal,Thomson Reuters,1038-1635	,	,1990	,4801,B
Australian Journal of Actuarial Practice (formerly Australian Actuarial Journal),Institute of Actuaries of Australia,2203-2290,2203-5354	,1997	,3502,C 
Australian Journal of Asian Law,Federation Press,1443-0738	,	,2000	,4801,C 
Australian Journal of Career Development,Sage Publications ,1038-4162	,2200-6974	,1992	,3505,B 
Australian Journal of Competition and Consumer Law (formerly Trade Practices Law Journal),Thomson Reuters,1838-9260	,	,1993	,4801,B 
Australian Journal of Corporate Law,LexisNexis,1037-4124	,	,1991	,4801,A
Australian Journal of Environmental Education,Cambridge University Press,0814-0626	,2049-775X	,1984	,3507,B 
Australian Journal of Human Rights,University of New South Wales ,1323-238X	,2573-573X	,1994	,3599,B
Australian Journal of International Affairs,Taylor & Francis Online,1035-7718	,1465-332X	,1947	,3599,A 
Australian Journal of Labour Economics: a journal of labour economics and labour relations,Centre for Labour Market Research,1328-1143	,	,1989	,3801,B 
Australian Journal of Labour Law,LexisNexis,1030-7222	,	,1988	,4801,A 
Australian Journal of Management,Sage Publications,0312-8962	,1327-2020	,1976	,3502,A 
Australian Journal of Political Science,Taylor & Francis Online,1036-1146	,1363-030X	,1956	,3599,A 
Australian Journal of Public Administration,Wiley-Blackwell Publishing,0313-6647	,1467-8500	,1937	,3599,A 
Australian Law Journal,Thomson Reuters,0004-9611	,	,1927	,4801,A 
