Journal Title,Publisher,ISSN,ISSNOnline,Year Inception,FoR,2025 rating
International Journal of Operations & Production Management,Emerald Group Publishing,0144-3577	,1758-6593	,1980	,3507,A
International Journal of Operations and Quantitative Management,International Forum of Management Scholars,1082-1910	,,1997	,3509,C
International Journal of Organization Theory & Behavior,Emerald Publishing,1093-4537,1532-4273,1998,3507,C
International Journal of Organizational Analysis,Emerald Group Publishing,1934-8835	,1758-8561	,1993	,3507,B 
International Journal of Pharmaceutical and Healthcare Marketing,Emerald Group Publishing,1750-6123,1750-6131,2007	,3506,C
International Journal of Physical Distribution & Logistics Management,Emerald Group Publishing,0960-0035	,1758-664X	,1970	,3509,A
International Journal of Political Economy,Taylor & Francis Online,0891-1916	,1558-0970	,1971	,3899,C
International Journal of Portfolio Analysis and Management,Inderscience Enterprises Ltd. ,2048-2361	,2048-237X	,2012	,3502,B 
International Journal of Production Economics,Elsevier,0925-5273	,1873-7579	,1976	,3507,A
International Journal of Production Research,Taylor & Francis Online,0020-7543	,1366-588X	,1961	,3507,A
International Journal of Productivity and Performance Management,Emerald Group Publishing,1741-0401	,1758-6658	,1952	,3505,B 
International Journal of Project Management,Elsevier,0263-7863	,1873-4634	,1983	,3507,A*
International Journal of Public Administration,Taylor & Francis Online,0190-0692	,1532-4265	,1979	,3507,B 
International Journal of Public Opinion Research,Oxford University Press ,,1471-6909	,1989	,3506,A
International Journal of Public Sector Management,Emerald Group Publishing,0951-3558	,1758-6666	,1988	,3507,B
International Journal of Quality & Reliability Management,Emerald Group Publishing,0265-671X	,1758-6682	,1984	,3507,B 
International Journal of Quality and Service Sciences,Emerald Group Publishing Limited,1756-669X	,1756-6703	,2009	,3506,B
International Journal of Research in Marketing,Elsevier ,0167-8116	,1873-8001	,1984	,3506,A*
International Journal of Retail & Distribution Management,Emerald Group Publishing,0959-0552	,1758-6690	,1973	,3506,A
International Journal of Revenue Management,Inderscience Enterprises Ltd.,1474-7332	,1741-8186	,2007	,3502,C 
International Journal of Risk Assessment and Management,Inderscience Enterprises Ltd,1466-8297	,1741-5241	,2000	,3502,C 
International Journal of Selection and Assessment,Wiley-Blackwell Publishing,0965-075X	,1468-2389	,1993	,3505,A 
International Journal of Small and Medium Enterprises ,,2576-7712,2576-7720,2018,3507,C
International Journal of Social and Humanistic Computing,Inderscience Enterprises Ltd.,1752-6124	,1752-6132	,2008	,4609,C 
International Journal of Social Economics,Emerald Group Publishing,0306-8293	,1758-6712	,1974	,3899,B 
International Journal of Social Research Methodology,Taylor & Francis Online,1364-5579	,1464-5300	,1998	,3507,B 
International Journal of Sociology and Social Policy,Emerald Group Publishing,0144-333X	,1758-6720	,1981	,3507,B 
International Journal of Spa and Wellness,Taylor & Francis Online,2472-1735,2472-1743,2018,3508,C 
International Journal of Sport Communication,"Human Kinetics Publishers, Inc. ",1936-3915	,1936-3907	,2008	,3504,B 
International Journal of Sport Finance,Sage Publications,1558-6235	,1930-076X	,2006	,3504,C 
International Journal of Sport Management,"American Press, Boston",1546-234X	,	,2000	,3504,B 
International Journal of Sport Policy and Politics,Taylor & Francis Online,1940-6940	,1940-6959	,2009	,3504,C
International Journal of Sport Psychology,"Edizioni Luigi Pozzi, Rome",0047-0767	,	,1970	,3504,B 
International Journal of Sports Management and Marketing,Inderscience Enterprises Ltd.,1475-8962	,1740-2808	,2005	,3506,B
International Journal of Sports Marketing and Sponsorship,Emerald Group Publishing,1464-6668	,2515-7841	,1999	,3506,B
International Journal of Stochastic Analysis,,2090-3332	,2090-3340	,1987	,4905,B 
International Journal of Strategic Communication,Taylor & Francis Online,1553-118X,1553-1198,2007,3506,B
International Journal of Strategic Property Management,Vilnius Gediminas Technical University,1648-715X	,1648-9179	,1997	,3504,B 
International Journal of Stress Management,American Psychological Association,1072-5245,1573-3424,1994,3507,A
International Journal of Sustainable Design,Inderscience Enterprises Ltd.,1743-8284	,1743-8292	,2008	,3506,C
International Journal of Sustainable Economy,Inderscience Enterprises Ltd.,1756-5804	,1756-5812	,2012	,3801,C 
International Journal of Sustainable Transportation,Taylor & Francis Online,1556-8318	,1556-8334	,2007	,3509,B 
International Journal of Systems Science: Operations and Logistics,Taylor & Francis,2330-2674,2330-2682,2014,3509,C
International Journal of Technology and Human Interaction,IGI Global,1548-3908	,1548-3916	,2005	,4609,C 
International Journal of Technology Management,Inderscience Enterprises Ltd.,0267-5730	,1741-5276	,1986	,3503,B 
International Journal of Technology Management and Sustainable Development,Intellect,1474-2748	,2040-0551	,2002	,3506,C
International Journal of Technology Marketing,Inderscience Enterprises Ltd.,1741-878X	,1741-8798	,2005	,3506,C
"International Journal of Technology, Knowledge and Society",Common Ground Research Networks,1832-3669	,	,2006	,4609,C 
International Journal of the Economics of Business,Taylor & Francis Online,1357-1516	,1466-1829	,1994	,3899,B 
International Journal of Theoretical and Applied Finance,World Scientific Publishing ,0219-0249	,1793-6322	,1998	,3502,B 
International Journal of Tourism Cities,Emerald Group Publishing,2056-5607	,2056-5615,2015	,3508,B
International Journal of Tourism Policy,Inderscience Enterprises Ltd.,1750-4090	,1750-4104	,2007	,3508,C
International Journal of Tourism Research,Wiley-Blackwell Publishing,1099-2340	,1522-1970	,1998	,3508,A
International Journal of Trade and Global Markets,Inderscience Enterprises Ltd.,1742-7541	,1742-755X	,2007	,3506,C
International Journal of Training and Development,Wiley-Blackwell Publishing,1360-3736	,1468-2419	,1997	,3505,C 
International Journal of Transport Economics,Istituti Editorialie Poligrafici Internazionali Pisa,0303-5247	,1724-2185	,1974	,3509,C 
International Journal of Urban and Regional Research,Wiley-Blackwell Publishing,0309-1317	,1468-2427	,1977	,3801,B 
"International Journal of Vehicle Design: journal of vehicle engineering, automotive technology and components",Inderscience Publishers,0143-3369	,1741-5314	,1979	,3509,B 
International Journal of Volunteer Administration,North Carolina State University,	,1942-728X	,2006	,3507,C 
International Journal of Web Based Communities,Inderscience Enterprises Ltd.,1477-8394	,1741-8216	,2004	,4609,C
International Journal of Wine Business Research,Emerald Group Publishing,1751-1062	,1751-1070	,1988	,3504,B 
International Journal of Work Organisation and Emotion,Inderscience Enterprises Ltd.,1740-8938	,1740-8946	,2005	,3507,B 
International Labor and Working-Class History,Cambridge University Press,0147-5479	,1471-6445	,1972	,3899,B 
International Labour Review,Wiley-Blackwell Publishing,0020-7780	,1564-913X	,1921	,3505,B 
International Marketing Review,Emerald Group Publishing,0265-1335	,1758-6763	,1983	,3506,A
International Migration,Wiley-Blackwell Publishing,0020-7985	,1468-2435	,1961	,3599,A
International Migration Review,Sage Publications,0197-9183	,1747-7379	,1966	,3599,A 
International Negotiation: a journal of theory and practice,Brill,1382-340X	,1571-8069	,1996	,3505,A 
International Organization,Cambridge University Press,0020-8183	,1531-5088	,1947	,3801,B 
International Papers in Political Economy,Springer Nature,2634-4955,1353-1158,2005	,3801,C 
International Public Management Journal,Taylor & Francis Online,1096-7494	,1559-3169	,1998	,3507,B
International Real Estate Review,Asian Real Estate Society,2154-8919	,	,1998	,3504,C 
International Regional Science Review,Sage Publications,0160-0176	,1552-6925	,1975	,3899,B 
International Review for the Sociology of Sport,Sage Publications,1012-6902	,1461-7218	,1966	,3504,B 
International Review of Administrative Sciences,Sage Publications,0020-8523	,1461-7226	,1957	,3507,B
International Review of Applied Economics,Taylor & Francis Online,0269-2171	,1465-3486	,1987	,3801,B 
International Review of Economics,Springer International Publishing,1865-1704	,1863-4613	,1954	,3801,C 
International Review of Economics & Finance,Elsevier ,1059-0560	,1873-8036	,1992	,3502,A 
International Review of Economics Education,Elsevier,1477-3880	,	,2003	,3801,C 
International Review of Environmental and Resource Economics,Now Publishers,1932-1465,1932-1473,2007,3801,B
International Review of Finance,Wiley-Blackwell Publishing,1369-412X	,1468-2443	,2000	,3502,A 
International Review of Financial Analysis,Elsevier,1057-5219	,1873-8079	,1992	,3502,A 
International Review of Information Ethics,International Center for Information Ethics (ICIE),1614-1687	,	,2004	,4609,C 
International Review of Law and Economics,Elsevier,0144-8188	,1873-6394	,1981	,3801,B 
"International Review of Law, Computers and Technology",Taylor & Francis Online,1360-0869	,1364-6885	,1984	,4801,A
International Review of Public Administration,Taylor & Francis Online,1229-4659	,2331-7795	,1999	,3599,B 
"International Review of Retail, Distribution and Consumer Research",Taylor & Francis Online,0959-3969	,1466-4402	,1990	,3506,B
International Review on Public and Nonprofit Marketing,Springer International Publishing,1865-1984	,1865-1992	,2004	,3506,B
International Small Business Journal,Sage Publications,0266-2426	,1741-2870	,1982	,3507,A 
International Social Science Journal,Wiley-Blackwell Publishing,	,1468-2451	,1949	,3599,B 
International Statistical Review,Wiley-Blackwell Publishing,0306-7734	,1751-5823	,1932	,4905,A 
International Studies of Management & Organization,Taylor & Francis Online,0020-8825	,1558-0911	,1971	,3507,B 
International Studies Quarterly,Wiley-Blackwell Publishing,0020-8833	,1468-2478	,1957	,3599,A 
International Tax and Public Finance,Springer International Publishing,0927-5940	,1573-6970	,1994	,4801,A
International Tax Journal,Panel Publishers ,0097-7314	,	,1974	,4801,C 
International Tax Review,Euromoney Institutional Investor PLC,0958-7594	,	,1989	,4801,C 
International Trade Journal,Taylor & Francis Online,0885-3908	,1521-0545	,1986	,3801,B 
International Transactions in Operational Research,Wiley-Blackwell Publishing,0969-6016	,1475-3995	,1994	,3509,B 
International Transfer Pricing Journal,International Bureau of Fiscal Documentation,1385-3074	,	,1993	,4801,C 
International VAT Monitor,International Bureau of Fiscal Documentation,0925-0832	,	,1990	,4801,B 
Internet Research,Emerald Group Publishing,1066-2243	,2054-5657	,1991	,4609,A 
Intertax: International Tax Review,Kluwer Law International ,0165-2826	,1875-8347	,1971	,4801,C 
Investment Analysts Journal,Taylor & Francis Online,1029-3523,2077-0227,1972,3502,B
IPPR Progressive Review,Wiley-Blackwell Publishing,,2573-2331	,1994	,3599,B 
Irish Journal of Management,Sciendo,1649-248X	,2451-2834	,1982	,3507,C 
Irish Marketing Review,University of Strathclyde,0790-7362	,	,1986	,3506,C
ISEAS Current Economic Affairs Series,Cambridge University Press,,,1991	,3801,C 
Islamic Economic Studies,SyndiGate Media Inc.,1319-1616	,	,	,3899,C 
ISRA International Journal of Islamic Finance,Emerald Group Publishing,0128-1976,2289-4365,2009,3502,C
Issues in Accounting Education,American Accounting Association,0739-3172	,1558-7983	,1983	,3501,A 
Issues in Social and Environmental Accounting: An International Journal,Sebelas Maret University,	,1978-0591	,2007	,3501,C 
Italian Economic Journal,Springer Nature,2199-322X,2199-3238,2015	,3801,B
Italian Journal of Marketing,Springer Nature Switzerland AG,2662-3323,2662-3331,,3506,C
IUP Journal of Accounting Research & Audit Practices,IUP Publications,0972-690X,,2009,3501,C
IUP Journal of Corporate Governance,IUP Publications,0972-6853,,2003,3501,C
IZA Journal of Labor Economics,Springer Nature,,2193-8997	,2012	,3801,A 
Japan and the World Economy,Elsevier ,0922-1425	,	,1988	,3801,B 
Japan Labor Issues,Japan Institute for Labour Policy and Training,2433-3689	,	,2017	,3505,C 
Japanese Economic Review,Wiley-Blackwell Publishing,1352-4739	,1468-5876	,1950	,3801,B 
JASSA: The Finsia Journal of Applied Finance,Financial Services Institute of Australasia,0313-5934	,	,1966	,3502,B 
Jindal Global Law Review,Springer Nature,0975-2498,2364-4869,2009,4801,C
Journal Ensayos Sobre Politica Economica (ESPE) / Essays on Economic Policy,"Department of Economic Policy Studies, Central Bank of Columbia",0120-4483	,	,1982	,3801,C 
Journal for Advancement of Marketing Education (JAME),Marketing Management Association,2326-3296	,1537-5137	,2001	,3506,C
Journal for Quality and Participation,American Society for Quality ,1040-9602	,1931-4019	,1978	,3505,C 
Journal for Studies in Economics & Econometrics,"University of Stellenbosch, Bureau for Economic Research",0379-6205	,	,1977	,3802,B 
Journal of Aboriginal Economic Development,Council for the Advancement of Native Development Officers (CANDO) and Captus Press Inc.,1481-9112	,1481-9120	,1999	,3801,C 
Journal of Academy of Business and Economics,International Academy of Business and Economics,1542-8710	,"2378-8631

	",2003	,3801,C 
Journal of Accountancy,Association of International Certified Professional Accountants,0021-8448	,1945-0729	,1905	,3501,C 
Journal of Accounting & Organizational Change,Emerald Group Publishing ,1832-5912	,1839-5473	,2005	,3501,B 
Journal of Accounting and Economics,Elsevier,0165-4101	,	,1979	,3501,A* 
Journal of Accounting and Finance in Emerging Economies,CSRC Publishing,2519-0318,2518-8488,,3501,C
Journal of Accounting and Management Information Systems (JAMIS),Bucharest University of Economic Studies ,1583-4387	,2559-6004	,2002	,3501,C 
Journal of Accounting and Public Policy,Elsevier,0278-4254	,1873-2070	,1982	,3501,A* 
Journal of Accounting Auditing and Finance,Sage Publications ,0148-558X	,2160-4061	,1986	,3501,A 
Journal of Accounting Education,Elsevier,0748-5751	,1873-1996	,1983	,3501,B 
Journal of Accounting in Emerging Economies,Emerald Group Publishing ,2042-1168	,2042-1176	,2011	,3501,B
Journal of Accounting Literature,Emerald Group Publishing ,0737-4607	,	,1981	,3501,A 
Journal of Accounting Research,Wiley-Blackwell Publishing,0021-8456	,1475-679X	,1963	,3501,A* 
Journal of Accounting Review,"National Chengchi University, Taiwan.",1018-1687,,,3501,C
"Journal of Accounting, Auditing and Business","Universitas Padjadjaran, Indonesia",,2614-3844,,3501,C
"Journal of Accounting, Business and Management",Malangkucecwara School of Economics,0216-423X	,2622-2167	,2005,3501,C 
"Journal of Accounting, Ethics and Public Policy",Dumont Institute for Public Policy Research,1089-652X	,	,1999	,3501,C 
Journal of Advanced Transportation,Hindawi,0197-6729	,2042-3195	,1966	,3509,B
Journal of Advertising,Taylor & Francis Online,0091-3367	,1557-7805	,1960	,3506,A
Journal of Advertising Education,Sage Publications,1098-0482	,,1998	,3506,C
Journal of Advertising Research,Taylor & Francis Online,0021-8499	,1740-1909	,1960	,3506,A
Journal of African Business,Taylor & Francis Online,1522-8916	,1522-9076	,2000	,3507,C 
Journal of African Development,African Finance and Economic Assocation,1060-6076	,	,1992	,3801,C 
Journal of African Economies,Oxford University Press ,0963-8024	,1464-3723	,1992	,3801,A 
Journal of Agribusiness in Developing and Emerging Economies,Emerald Group Publishing,2044-0839	,2044-0847	,2011	,3899,C 
Journal of Agricultural & Food Industrial Organization,De Gruyter,1542-0485	,2194-5896	,2002	,3801,C 
Journal of Agricultural and Applied Economics,Cambridge University Press,1074-0708	,2056-7405	,1969	,3801,C 
Journal of Agricultural and Resource Economics,Western Agricultural Economics Association,1068-5502	,2327-8285	,1992	,3899,A 
Journal of Agricultural Economics,Wiley-Blackwell Publishing,0021-857X	,1477-9552	,1928	,3801,A
"Journal of Agricultural, Biological and Environmental Statistics",Springer International Publishing,1085-7117	,1537-2693	,1996	,4905,B 
Journal of Air Law and Commerce,Southern Methodist University,0021-8642	,	,1930	,4801,A 
Journal of Air Transport Management,Elsevier ,0969-6997	,1873-2089	,1994	,3509,B
Journal of Applied Accounting Research,Emerald Group Publishing ,0967-5426	,1758-8855	,1993	,3501,B
Journal of Applied Business and Economics,North American Business Press,1499-691X	,	,2000	,3801,C
Journal of Applied Corporate Finance,Wiley-Blackwell Publishing,1078-1196	,1745-6622	,1988	,3502,A 
Journal of Applied Econometrics,Wiley-Blackwell Publishing,0883-7252	,1099-1255	,1986	,3802,A* 
Journal of Applied Economic Sciences,ASERS Publishing,1843-6110	,2393-5162	,2006	,3801,C 
Journal of Applied Economics,Taylor & Francis Online,1514-0326	,1667-6726	,1998	,3801,B 
"Journal of Applied Finance: theory, practice, education",Financial Management Association International (FMA),1534-6668	,	,1991	,3502,C 
Journal of Applied Law and Policy,Curtin University ,1836-6953	,	,2008	,4801,C 
Journal of Applied Management and Entrepreneurship,Nova Southeastern University,1077-1158	,1077-1158	,1994	,3507,C 
Journal of Applied Probability,Applied Probability Trust,0021-9002	,1475-6072	,1964	,4905,A 
Journal of Applied Psychology,American Psychological Association ,0021-9010	,1939-1854	,1917	,3507,A* 
Journal of Applied Social Psychology,Wiley-Blackwell Publishing,0021-9029	,1559-1816	,1971	,3507,B 
Journal of Applied Sport Management,Sagamore Publishing,2327-0187,,2009,3504,C
Journal of Applied Sport Psychology,Taylor & Francis Online,1041-3200	,1533-1571	,1989	,3504,A 
Journal of Applied Statistical Science,Nova Science Publishers ,1067-5817	,	,1993	,4905,C 
Journal of Applied Statistics,Taylor & Francis Online,0266-4763	,1360-0532	,1974	,4905,B 
Journal of Arts Management Law and Society,Taylor & Francis Online,1063-2921	,1930-7799	,1969	,3504,C 
Journal of Asia Business Studies,Emerald Group Publishing Limited,1558-7894	,1559-2243	,2006	,3507,C
Journal of Asia Entrepreneurship and Sustainability,Asia Academic Press,1177-4541,1176-8592,,3507,C 
Journal of Asia Pacific Business,Taylor & Francis Online,1059-9231	,1528-6940	,1995	,3507,C 
Journal of Asian Business and Economic Studies,Emerald Publishing,2515-964X,,2018	,3801,B
Journal of Asian Economics,Elsevier ,1049-0078	,1873-7927	,1990	,3801,B
Journal of Australian Political Economy,Australian Political Economy Movement ,0156-5826	,	,1977	,3899,B 
Journal of Australian Taxation,Monash University ,1440-0405	,	,1998	,4801,A
Journal of Banking & Finance,Elsevier,0378-4266	,1872-6372	,1976	,3502,A* 
Journal of Banking and Finance - Law and Practice,Thomson Reuters,1034-3040	,	,	,4801,A 
Journal of Banking Regulation,Springer International Publishing,1745-6452	,1750-2071	,2001	,4801,C 
Journal of Behavioral and Experimental Economics,Elsevier ,2214-8043,,1972	,3801,A
Journal of Behavioral and Experimental Finance,Elsevier,2214-6350	,	,2014	,3502,A
Journal of Behavioral Decision Making,Wiley-Blackwell Publishing,0894-3257	,1099-0771	,1988	,3507,A 
Journal of Behavioral Finance,Taylor & Francis Online,1542-7560	,1542-7579	,2000	,3502,A 
Journal of Benefit-Cost Analysis,Cambridge University Press,2152-2812	,	,2010	,3899,C 
Journal of Bioeconomics,Springer International Publishing,1387-6996	,1573-6989	,1999	,3899,C 
Journal of Biopharmaceutical Statistics,Taylor & Francis Online,1054-3406	,1520-5711	,1991	,4905,C 
Journal of Brand Management,Springer International Publishing,1350-231X	,1479-1803	,1993	,3506,A
Journal of Business & Economic Statistics,Taylor & Francis Online,0735-0015	,1537-2707	,1983	,3802,A*
Journal of Business & Economic Studies,Northeast Business & Economics Association (NBEA),1063-343X	,2576-3458	,1994	,3801,C 
Journal of Business & Industrial Marketing,Emerald Group Publishing,0885-8624	,2052-1189	,1986	,3506,A
Journal of Business Analytics,Taylor & Francis Online,2573-234X,2573-2358,2018,4609,C
Journal of Business and Economic Perspectives,The University of Tennessee at Martin,1528-5014	,	,2010	,3801,C 
Journal of Business and Economics Research,The Clute Institute ,1542-4448	,2157-8893	,2003	,3801,C 
Journal of Business and Management,"Department of Management Information Systems at College of Commerce, National Chengchi University",1535-668X	,,1993	,3507,C 
Journal of Business and Psychology,Springer International Publishing,0889-3268	,1573-353X	,1986	,3507,A
Journal of Business and Technical Communication,Sage Publications,1050-6519	,1552-4574	,1987	,3507,C 
Journal of Business Chemistry,Institute of Business Administration ,1613-9615	,1613-9623	,2004	,3507,C 
Journal of Business Cycle Research,Springer International Publishing,2509-7962	,2509-7970	,2004	,3801,B 
Journal of Business Economics,Springer Nature,0044-2372,1861-8928,1924,3507,B
Journal of Business Economics and Management,Taylor & Francis Online,1611-1699	,2029-4433	,1999	,3801,B
Journal of Business Ethics,Springer International Publishing,0167-4544	,1573-0697	,1982	,3507,A
Journal of Business Finance & Accounting,Wiley-Blackwell Publishing,0306-686X	,1468-5957	,1974	,3501,A*
Journal of Business Law,Sweet & Maxwell ,0021-9460	,	,1957	,4801,A 
Journal of Business Logistics,Wiley-Blackwell Publishing,0735-3766	,2158-1592	,1978	,3509,A
Journal of Business Market Management,Springer International Publishing,1864-0753	,1864-0761	,2007	,3506,B 
Journal of Business Models,Emerald Publishing,2246-2465,,2013,3507,C
Journal of Business Research,Elsevier ,0148-2963	,1873-7978	,1973	,3506,A
Journal of Business Strategy,Emerald Group Publishing,0275-6668	,2052-1197	,1980	,3507,B 
Journal of Business Studies ,Faculty of Management Studies & Commerce University of Jaffna - Sri Lanka,2362-0269,,2013,3507,C
Journal of Business Thought,Sri Guru Gobind Singh College of Commerce,2581-8104,2231-1734,2012	,3801,C 
Journal of Business Venturing,Elsevier,0883-9026	,1873-2003	,1985	,3507,A* 
Journal of Business Venturing Insights,Elsevier,2352-6734,,2014,3507,A
Journal of Business-to-Business Marketing,Taylor & Francis Online,1051-712X	,1547-0628	,1993	,3506,B
Journal of Career Assessment,Sage Publications,1069-0727	,1552-4590	,1993	,3505,A 
Journal of Career Development,Sage Publications,0894-8453	,1556-0856	,1972	,3505,B 
Journal of Case Studies ,Society for Case Research,2328-700X,,,3599,C
Journal of Cases on Information Technology,IGI Global,1548-7717	,1548-7725	,1999	,4609,C
Journal of Change Management,Taylor & Francis Online,1469-7017	,1479-1811	,2000	,3507,C 
Journal of China Tourism Research,Taylor & Francis Online,1938-8160	,1938-8179	,2005	,3508,B
Journal of Chinese Economic and Foreign Trade Studies,Emerald Group Publishing,1754-4408	,1754-4416	,2008	,3899,C 
Journal of Chinese Economics and Business Studies,Taylor & Francis Online,1476-5284	,1476-5292	,2003	,3801,C 
Journal of Chinese Tax and Policy,The University of Sydney ,1839-065X	,	,2011	,4801,C 
Journal of Choice Modelling,Elsevier ,1755-5345	,	,2008	,3803,A
Journal of Cleaner Production,Elsevier ,0959-6526,1879-1786,1993	,3507,C
Journal of Co-operative Studies,UK Society for Co-operative Studies,0961-5784,	,1987	,3507,C 
Journal of Commerce and Accounting Research,Publishing India Group,2277-2146,2320-4990,2012,3501,C
Journal of Commodity Markets,Elsevier,2405-8513	,2405-8505	,2016	,3502,A
Journal of Common Market Studies,Wiley-Blackwell Publishing,0021-9886	,1468-5965	,1962	,3801,B 
Journal of Communication,Oxford University Press,0021-9916	,1460-2466	,1951	,3599,A 
Journal of Communication Management,Emerald Group Publishing,1363-254X	,1478-0852	,1996	,3506,B
Journal of Community Informatics,Community Informatics Research Network,	,1712-4441	,2004	,4609,C
Journal of Comparative Economics,Elsevier ,0147-5967	,1095-7227	,1977	,3899,A 
Journal of Comparative International Management,Array,1481-0468	,1718-0864	,1998	,3507,C 
Journal of Comparative Policy Analysis: research and practice,Taylor & Francis Online,1387-6988	,1572-5448	,1998	,3599,B 
Journal of Competition Law and Economics,Oxford University Press ,1744-6414	,1744-6422	,2005	,3801,B 
Journal of Computational and Graphical Statistics,Taylor & Francis Online,1061-8600	,1537-2715	,1992	,4905,A* 
Journal of Computational Finance,Incisive Risk Information Limited,1460-1559	,1755-2850	,1997	,3502,C 
Journal of Computer Information Systems,Taylor & Francis Online,0887-4417	,2380-2057	,1960	,4609,A 
Journal of Conflict Resolution,Sage Publications,0022-0027	,1552-8766	,1957	,3801,A* 
Journal of Construction Accounting and Taxation,"Warren, Gorham & Lamont, Inc.: Thomson Reuters",1054-3007	,	,1991	,4801,C 
Journal of Construction Engineering and Management,American Society of Civil Engineers,0733-9364	,1943-7862	,1983	,3504,A* 
Journal of Constructivist Psychology,Taylor & Francis Online,1072-0537	,1521-0650	,1994	,3507,B 
Journal of Consumer Affairs,Wiley-Blackwell Publishing,0022-0078	,1745-6606	,1967	,3506,A
Journal of Consumer Behaviour,Wiley-Blackwell Publishing,1472-0817	,1479-1838	,2001	,3506,A
Journal of Consumer Marketing,Emerald Group Publishing,0736-3761	,2052-1200	,1984	,3506,A
Journal of Consumer Policy,Springer International Publishing,0168-7034	,1573-0700	,1983	,3801,C 
Journal of Consumer Psychology,Wiley-Blackwell Publishing,1057-7408	,1532-7663	,1992	,3506,A*
Journal of Consumer Research,Oxford University Press ,0093-5301	,1537-5277	,1974	,3506,A*
"Journal of Consumer Satisfaction, Dissatisfaction and Complaining Behavior","Consumer Satisfaction, Dissatisfaction, and Complaining Behavior, Inc",0899-8620	,	,1988	,3506,C
Journal of Contemporary Accounting and Economics,Elsevier,1815-5669	,	,2005	,3501,A 
Journal of Contemporary Business Issues,Western Illinois University,0194-0430	,1553-5347	,1988	,3507,C 
Journal of Contract Law,LexisNexis,1030-7230	,	,1988	,4801,A
